{
  "$schema": "https://json-schema.org/draft/2020-12/schema",
  "$id": "https://anito.dev/schemas/setup-state/v1.json",
  "title": "AnitoSetupState",
  "description": "Tracks which setup steps have been applied in this project. Lives at .anito/setup-state.json in the consuming repo. Committed to git.",
  "type": "object",
  "required": ["schemaVersion", "appliedSteps"],
  "additionalProperties": false,
  "properties": {
    "schemaVersion": {
      "type": "string",
      "pattern": "^\\d+\\.\\d+\\.\\d+$",
      "description": "Semantic version of this schema. Used by Anito to detect when migrations are needed."
    },
    "anitoBinaryVersion": {
      "type": "string",
      "pattern": "^\\d+\\.\\d+\\.\\d+$",
      "description": "Version of the Anito binary that last ran setup."
    },
    "projectName": {
      "type": "string",
      "description": "Name of this project. Matches the name used in service configs."
    },
    "lastSetupAt": {
      "type": "string",
      "format": "date-time",
      "description": "ISO 8601 timestamp of the last setup run."
    },
    "bootstrapped": {
      "type": "boolean",
      "description": "True if this state file was synthesized from an existing .anito/config.yaml rather than recorded during a real first-run setup. Signals that appliedAt timestamps and anitoBinaryVersion may be approximate. Anito treats bootstrapped state files with extra caution — it will not overwrite existing config without confirmation."
    },
    "appliedSteps": {
      "type": "array",
      "description": "Ordered list of setup steps that have been applied to this project.",
      "items": {
        "$ref": "#/$defs/AppliedStep"
      }
    }
  },
  "$defs": {
    "AppliedStep": {
      "type": "object",
      "required": ["id", "stepVersion", "appliedAt"],
      "additionalProperties": false,
      "properties": {
        "id": {
          "type": "string",
          "description": "Stable identifier for this setup step. Never changes between schema versions."
        },
        "stepVersion": {
          "type": "string",
          "pattern": "^\\d+\\.\\d+\\.\\d+$",
          "description": "Schema version in which this step was introduced."
        },
        "description": {
          "type": "string",
          "description": "Human-readable summary of what this step did."
        },
        "appliedAt": {
          "type": "string",
          "format": "date-time",
          "description": "ISO 8601 timestamp of when this step was applied."
        },
        "data": {
          "type": "object",
          "description": "Step-specific data captured at setup time. Shape varies by step ID.",
          "additionalProperties": true
        }
      }
    }
  }
}
